{
  "$schema": "http://json-schema.org/draft-07/schema#",
  "$id": "https://github.com/riccarvalhinho/Ratatouille/data/schema/recipe.schema.json",
  "title": "Receita",
  "description": "Uma receita. Um ficheiro por receita em data/recipes/<id>.json. As decisões por trás de cada campo estão em docs/product/metadata-receitas.md e em docs/conversas/01-metadata-receitas.md.",
  "type": "object",
  "additionalProperties": false,
  "allOf": [
    {
      "description": "Uma receita revista tem de estar completa. Um rascunho pode ter buracos, mas tem de os declarar em gaps — é o que impede um ficheiro incompleto de passar por pronto.",
      "if": {
        "properties": { "status": { "const": "rascunho" } },
        "required": ["status"]
      },
      "then": {
        "required": ["id", "name", "labels", "ingredients", "steps", "gaps"],
        "properties": { "gaps": { "minItems": 1 } }
      },
      "else": {
        "required": ["id", "name", "labels", "methods", "timing", "ingredients", "steps"],
        "anyOf": [{ "required": ["servings"] }, { "required": ["yield"] }],
        "properties": {
          "steps": {
            "description": "Numa receita revista, todos os passos têm título. Um rascunho pode não ter — e é isso que o distingue.",
            "items": { "required": ["title", "text"] }
          }
        }
      }
    }
  ],
  "properties": {
    "id": {
      "description": "Slug único. Tem de ser igual ao nome do ficheiro sem extensão.",
      "type": "string",
      "pattern": "^[a-z0-9]+(-[a-z0-9]+)*$"
    },
    "name": { "type": "string", "minLength": 1 },
    "description": {
      "description": "Uma ou duas frases. Opcional.",
      "type": "string"
    },
    "narrative": {
      "description": "A receita em texto corrido, numa transcrição nossa. Nunca o texto original de outra pessoa — ver docs/ops/importar-receitas.md. Serve de rede de segurança da importação e de leitura corrida.",
      "type": "string"
    },
    "status": {
      "description": "Ausente significa \"revisto\": uma receita escrita à mão está revista por quem a escreveu. O importador escreve sempre \"rascunho\".",
      "enum": ["rascunho", "revisto"]
    },
    "gaps": {
      "description": "Campos que o importador não conseguiu determinar. É a lista de perguntas que a revisão vai fazer.",
      "type": "array",
      "uniqueItems": true,
      "items": { "type": "string", "minLength": 1 }
    },
    "image": {
      "description": "Caminho relativo à raiz do repositório, ex.: media/recipes/<id>.jpg",
      "type": "string",
      "pattern": "^media/recipes/[a-z0-9-]+\\.(jpg|jpeg|png|webp)$"
    },
    "imageCredit": {
      "description": "Atribuição da imagem, obrigatória quando a imagem vem de uma fonte de licença livre. Sem isto a licença não é cumprida e o repositório é público.",
      "type": "object",
      "required": ["license"],
      "additionalProperties": false,
      "properties": {
        "author": { "type": "string" },
        "license": {
          "description": "Ex.: \"CC BY 4.0\", \"CC0 1.0\", \"PDM 1.0\", ou \"própria\" para fotografia nossa.",
          "type": "string",
          "minLength": 1
        },
        "licenseUrl": { "type": "string", "format": "uri" },
        "sourceUrl": { "type": "string", "format": "uri" }
      }
    },
    "servings": {
      "description": "Para quantas pessoas dá a dose declarada. Opcional: há receitas que rendem unidades e não pessoas — nesse caso usa-se yield. Tem de existir servings ou yield.",
      "type": "integer",
      "minimum": 1,
      "maximum": 50
    },
    "yield": {
      "description": "Rendimento que não são pessoas: \"30 bolachas\", \"1 bolo de 24 cm\", \"1 kg de compota\". Complementa ou substitui servings.",
      "type": "string",
      "minLength": 1
    },
    "needsSide": {
      "description": "A receita é só o prato: come-se com alguma coisa ao lado que ela não traz. Ausente significa que a receita dá uma refeição — que é o caso normal, porque o acompanhamento escreve-se dentro da receita por omissão (ver .claude/skills/importar-receita/SKILL.md). Só se declara a exceção, como no status: o prato que já é refeição não precisa de dizer que é.",
      "type": "boolean",
      "default": false
    },
    "labels": {
      "description": "Referências a data/taxonomies/labels.json. O vocabulário está por rever — ver docs/conversas/07-vocabulario-labels.md.",
      "type": "array",
      "minItems": 1,
      "uniqueItems": true,
      "items": { "type": "string", "pattern": "^[a-z0-9]+(-[a-z0-9]+)*$" }
    },
    "methods": {
      "description": "Como se confeciona. Responde a \"tenho de ligar o forno?\", que é dos primeiros filtros mentais, e alimenta a estimativa do campo weight. Uma receita pode ter mais do que um.",
      "type": "array",
      "minItems": 1,
      "uniqueItems": true,
      "items": {
        "enum": ["forno", "tacho", "frigideira", "grelhador", "airfryer", "micro-ondas", "sem-confecao"]
      }
    },
    "weight": {
      "description": "Quão substancial é a refeição, comparada com outras do mesmo tipo de prato. Atribuído pelo importador a partir de uma rubrica escrita (ver docs/product/metadata-receitas.md), nunca calculado a partir de nutrição estimada. Substitui a ideia de uma etiqueta \"saudável\".",
      "enum": ["leve", "equilibrado", "substancial"]
    },
    "timing": {
      "type": "object",
      "required": ["prepMinutes", "cookMinutes"],
      "additionalProperties": false,
      "properties": {
        "prepMinutes": {
          "description": "Tempo ativo de preparação. Entra no total. Se a fonte não o trouxer, o importador estima.",
          "type": "integer",
          "minimum": 0
        },
        "cookMinutes": {
          "description": "Tempo de confeção. Entra no total.",
          "type": "integer",
          "minimum": 0
        },
        "prepAhead": {
          "description": "Antecedência necessária que não é tempo ativo: marinar, demolhar, levedar, arrefecer. NÃO entra no total, porque não é tempo passado na cozinha.",
          "type": "object",
          "required": ["minutes", "description"],
          "additionalProperties": false,
          "properties": {
            "minutes": { "type": "integer", "minimum": 1 },
            "description": { "type": "string", "minLength": 1 }
          }
        }
      }
    },
    "equipment": {
      "description": "Referências a data/taxonomies/equipment.json. A app mostra só os que lá estão marcados como não comuns.",
      "type": "array",
      "uniqueItems": true,
      "items": { "type": "string", "pattern": "^[a-z0-9]+(-[a-z0-9]+)*$" }
    },
    "ingredients": {
      "description": "Lista única. Não há grupos: as sub-preparações são partes da preparação total do prato.",
      "type": "array",
      "minItems": 1,
      "items": {
        "type": "object",
        "required": ["ref"],
        "additionalProperties": false,
        "properties": {
          "ref": {
            "description": "Ingrediente canónico em data/taxonomies/ingredients.json. Nunca texto livre — é o que torna a lista de compras possível.",
            "type": "string",
            "pattern": "^[a-z0-9]+(-[a-z0-9]+)*$"
          },
          "quantity": { "type": "number", "exclusiveMinimum": 0 },
          "unit": {
            "description": "qb = quanto baste. csopa = colher de sopa. ccha = colher de chá.",
            "enum": ["g", "kg", "ml", "l", "un", "csopa", "ccha", "pitada", "qb"]
          },
          "note": {
            "description": "Preparação ou qualificador, ex.: 'picada', 'em cubos'. Mostrado subordinado ao nome, não a competir com ele.",
            "type": "string"
          },
          "optional": { "type": "boolean", "default": false }
        },
        "allOf": [
          {
            "description": "Se há quantidade tem de haver unidade.",
            "if": { "required": ["quantity"] },
            "then": { "required": ["unit"] }
          },
          {
            "description": "A unidade qb não leva quantidade.",
            "if": { "properties": { "unit": { "const": "qb" } }, "required": ["unit"] },
            "then": { "not": { "required": ["quantity"] } }
          }
        ]
      }
    },
    "steps": {
      "description": "Passos ao nível de tarefa: uma ação e a espera que lhe pertence. Dois limites governam a granularidade. Em baixo, o título é o teste — se o título disser tudo o que o texto diz, o passo é pequeno de mais e junta-se ao vizinho ('junte as batatas' seguido de 'coza' é um passo, não dois). Em cima, manda o temporizador: um passo tem uma duração e um passive, portanto duas esperas seguidas nunca cabem no mesmo passo. O estado de execução — em que passo se vai, o que está concluído — NÃO vive aqui: é estado efémero da aplicação.",
      "type": "array",
      "minItems": 1,
      "items": {
        "type": "object",
        "required": ["text"],
        "additionalProperties": false,
        "properties": {
          "title": {
            "description": "O que se faz, em duas ou três palavras: \"Cozer as batatas\", \"Fazer o roux\". O modo cozinha mostra-o em grande e o detalhe usa-o para a lista se ler de relance. Escreve-se a saber que o texto existe: o título leva o verbo e o objeto, o texto leva só o que o título não diz. Se der para ler os dois seguidos e ouvir a mesma coisa duas vezes, um dos dois está mal escrito.",
            "type": "string",
            "minLength": 1,
            "maxLength": 60
          },
          "text": {
            "description": "O que é preciso saber para não fazer mal o que o título anuncia: o como, o até quando, a ressalva. Nunca repete o título.",
            "type": "string",
            "minLength": 1,
            "maxLength": 280
          },
          "durationMinutes": {
            "description": "Alimenta o temporizador do modo cozinha.",
            "type": "integer",
            "minimum": 1
          },
          "temperatureC": {
            "description": "Temperatura em graus Celsius, quando o passo a exige. Estruturada e não enterrada no texto, porque o modo cozinha tem de a mostrar como dado ao lado do temporizador.",
            "type": "integer",
            "minimum": 1,
            "maximum": 300
          },
          "passive": {
            "description": "Passo em que se sai da cozinha — levedar, arrefecer, marinar, assar sem mexer. Um passo passivo deve avisar quando acabar; um ativo não precisa, porque já se está a olhar.",
            "type": "boolean",
            "default": false
          },
          "ingredientRefs": {
            "description": "Ingredientes usados neste passo, para os mostrar junto ao passo no modo cozinha.",
            "type": "array",
            "uniqueItems": true,
            "items": { "type": "string", "pattern": "^[a-z0-9]+(-[a-z0-9]+)*$" }
          }
        }
      }
    },
    "nutrition": {
      "description": "Por dose. O ideal é o painel completo; o mínimo aceitável é só as calorias. O campo method existe para não fingirmos rigor que não temos.",
      "type": "object",
      "required": ["method"],
      "additionalProperties": false,
      "properties": {
        "method": { "enum": ["calculado", "estimado"] },
        "calories": { "type": "number", "minimum": 0 },
        "proteinGrams": { "type": "number", "minimum": 0 },
        "carbsGrams": { "type": "number", "minimum": 0 },
        "fatGrams": { "type": "number", "minimum": 0 },
        "saturatedFatGrams": { "type": "number", "minimum": 0 },
        "fibreGrams": { "type": "number", "minimum": 0 },
        "saltGrams": {
          "description": "Sal em gramas, como nos rótulos portugueses. O Cookidoo mostra sódio em mg; sal = sódio × 2,5.",
          "type": "number",
          "minimum": 0
        }
      }
    },
    "source": {
      "description": "De onde veio a receita. As instruções são sempre reescritas, nunca copiadas.",
      "type": "object",
      "additionalProperties": false,
      "properties": {
        "kind": {
          "description": "gerada = escrita por AI a partir do nome do prato, sem fonte externa. Revista por um humano no papel, mas nunca cozinhada — é o que a distingue de uma receita da família.",
          "enum": ["propria", "familia", "livro", "web", "video", "importada", "gerada"]
        },
        "title": { "type": "string" },
        "author": {
          "description": "Autor, canal ou publicação de origem.",
          "type": "string"
        },
        "url": { "type": "string", "format": "uri" }
      }
    },
    "notes": {
      "description": "Notas pessoais: 'a avó fazia com mais alho', 'da última vez ficou salgado'. Sem interface por agora — escrevem-se à mão.",
      "type": "string"
    },
    "createdAt": { "type": "string", "format": "date" },
    "updatedAt": { "type": "string", "format": "date" }
  }
}
