{
  "id": "arroz-de-marisco",
  "name": "Arroz de marisco",
  "description": "Arroz malandro num caldo feito das cascas, com camarão, amêijoa e mexilhão.",
  "image": "media/recipes/arroz-de-marisco.jpg",
  "imageCredit": {
    "author": "Geoffreyrabbit",
    "license": "CC BY-SA 4.0",
    "licenseUrl": "https://creativecommons.org/licenses/by-sa/4.0",
    "sourceUrl": "https://commons.wikimedia.org/wiki/File:Steamed_mixed_seafood_rice_in_dinner.jpg"
  },
  "narrative": "O caldo faz-se das cascas e cabeças dos camarões — é o passo que separa isto de arroz com marisco por cima, e leva vinte minutos. O refogado é de cebola, alho, pimento e tomate, demorado. O arroz coze nesse caldo, malandro, com mais líquido do que um arroz seco, porque continua a beber no prato. O marisco entra nos últimos minutos e as amêijoas fechadas deitam-se fora.",
  "servings": 5,
  "labels": [
    "prato-principal",
    "marisco",
    "massa-e-arroz",
    "portuguesa",
    "festa"
  ],
  "methods": [
    "tacho"
  ],
  "weight": "equilibrado",
  "timing": {
    "prepMinutes": 30,
    "cookMinutes": 45,
    "prepAhead": {
      "minutes": 240,
      "description": "Pôr as amêijoas em água com sal quatro horas a largar areia"
    }
  },
  "equipment": [
    "placa",
    "panela-grande",
    "tacho",
    "coador",
    "ralador"
  ],
  "ingredients": [
    {
      "ref": "camarao",
      "quantity": 600,
      "unit": "g"
    },
    {
      "ref": "ameijoa",
      "quantity": 500,
      "unit": "g",
      "note": "de véspera em água e sal"
    },
    {
      "ref": "mexilhao",
      "quantity": 500,
      "unit": "g"
    },
    {
      "ref": "arroz-carolino",
      "quantity": 350,
      "unit": "g"
    },
    {
      "ref": "cebola",
      "quantity": 2,
      "unit": "un"
    },
    {
      "ref": "dente-de-alho",
      "quantity": 4,
      "unit": "un"
    },
    {
      "ref": "pimento-vermelho",
      "quantity": 1,
      "unit": "un"
    },
    {
      "ref": "tomate",
      "quantity": 3,
      "unit": "un",
      "note": "ralados"
    },
    {
      "ref": "vinho-branco",
      "quantity": 150,
      "unit": "ml"
    },
    {
      "ref": "azeite",
      "quantity": 5,
      "unit": "csopa"
    },
    {
      "ref": "folha-de-louro",
      "quantity": 2,
      "unit": "un"
    },
    {
      "ref": "coentros",
      "unit": "qb"
    },
    {
      "ref": "piri-piri",
      "unit": "qb",
      "optional": true
    },
    {
      "ref": "agua",
      "quantity": 2,
      "unit": "l"
    },
    {
      "ref": "sal",
      "unit": "qb"
    }
  ],
  "steps": [
    {
      "title": "Fazer o caldo das cascas",
      "text": "Descascar os camarões e cozer cascas e cabeças em água com uma cebola, o louro e sal. Coar e manter quente.",
      "durationMinutes": 25,
      "passive": true,
      "ingredientRefs": [
        "camarao",
        "cebola",
        "folha-de-louro",
        "agua",
        "sal"
      ]
    },
    {
      "title": "Fazer o refogado",
      "text": "Resto da cebola, alho, pimento e tomate ralado no azeite, em lume brando, até apurar.",
      "durationMinutes": 15,
      "ingredientRefs": [
        "dente-de-alho",
        "pimento-vermelho",
        "tomate",
        "azeite"
      ]
    },
    {
      "title": "Cozer o arroz no caldo",
      "text": "Arroz dois minutos no refogado, vinho branco a evaporar, depois o caldo quente de sobra. Dezoito minutos, malandro.",
      "durationMinutes": 20,
      "ingredientRefs": [
        "arroz-carolino",
        "vinho-branco"
      ]
    },
    {
      "title": "Juntar o marisco",
      "text": "Amêijoas e mexilhões nos últimos cinco minutos, tapado, até abrirem. Camarões nos últimos dois. Deitar fora os fechados.",
      "durationMinutes": 7,
      "ingredientRefs": [
        "ameijoa",
        "mexilhao"
      ]
    },
    {
      "title": "Rematar com coentros",
      "text": "Coentros picados fora do lume e piri-piri à mesa.",
      "durationMinutes": 3,
      "ingredientRefs": [
        "coentros",
        "piri-piri"
      ]
    }
  ],
  "nutrition": {
    "method": "estimado",
    "calories": 720,
    "proteinGrams": 48,
    "carbsGrams": 82,
    "fatGrams": 20,
    "saturatedFatGrams": 3,
    "fibreGrams": 4,
    "saltGrams": 3.2
  },
  "source": {
    "kind": "gerada",
    "author": "Claude"
  },
  "createdAt": "2026-09-15",
  "updatedAt": "2026-09-15"
}
