{
  "id": "salada-de-feijao-frade-com-ovo",
  "name": "Salada de feijão frade com ovo",
  "description": "Feijão frade com ovo cozido, cebola e salsa. Clássico de verão.",
  "image": "media/recipes/salada-de-feijao-frade-com-ovo.jpg",
  "imageCredit": {
    "author": "Shameel mukkath",
    "license": "Pexels License",
    "licenseUrl": "https://www.pexels.com/license/",
    "sourceUrl": "https://www.pexels.com/photo/healthy-baked-beans-5191842/"
  },
  "narrative": "Come-se morna ou fria, e morna é melhor — o feijão ainda tépido absorve o tempero de outra maneira. A cebola pica-se muito fina e a salsa entra em quantidade, não como enfeite. Um fio de vinagre de vinho é obrigatório: sem ele a salada é plana.",
  "servings": 4,
  "labels": [
    "salada",
    "acompanhamento",
    "ovos",
    "leguminosas",
    "portuguesa",
    "dia-a-dia",
    "vegetariano",
    "sem-gluten",
    "sem-lactose"
  ],
  "methods": [
    "tacho"
  ],
  "weight": "equilibrado",
  "timing": {
    "prepMinutes": 10,
    "cookMinutes": 15
  },
  "equipment": [
    "placa",
    "tacho",
    "taca"
  ],
  "ingredients": [
    {
      "ref": "feijao-frade-cozido",
      "quantity": 700,
      "unit": "g",
      "note": "escorrido"
    },
    {
      "ref": "ovo",
      "quantity": 4,
      "unit": "un"
    },
    {
      "ref": "cebola",
      "quantity": 1,
      "unit": "un",
      "note": "picada fina"
    },
    {
      "ref": "dente-de-alho",
      "quantity": 1,
      "unit": "un"
    },
    {
      "ref": "salsa",
      "unit": "qb"
    },
    {
      "ref": "azeite",
      "quantity": 6,
      "unit": "csopa"
    },
    {
      "ref": "vinagre-de-vinho",
      "quantity": 2,
      "unit": "csopa"
    },
    {
      "ref": "sal",
      "unit": "qb"
    },
    {
      "ref": "pimenta-preta",
      "unit": "qb"
    }
  ],
  "steps": [
    {
      "title": "Cozer os ovos",
      "text": "Dez minutos em água a ferver. Arrefecer e descascar.",
      "durationMinutes": 12,
      "passive": true,
      "ingredientRefs": [
        "ovo"
      ]
    },
    {
      "title": "Aquecer o feijão",
      "text": "Feijão lavado e escorrido, morno, num tacho com um pouco de água.",
      "durationMinutes": 6,
      "ingredientRefs": [
        "feijao-frade-cozido"
      ]
    },
    {
      "title": "Temperar ainda morno",
      "text": "Cebola picada fina, alho, salsa em quantidade, azeite, vinagre, sal e pimenta.",
      "durationMinutes": 6,
      "ingredientRefs": [
        "cebola",
        "dente-de-alho",
        "salsa",
        "azeite",
        "vinagre-de-vinho",
        "sal",
        "pimenta-preta"
      ]
    },
    {
      "title": "Juntar o ovo",
      "text": "Ovo aos gomos por cima, sem envolver, para não desfazer.",
      "durationMinutes": 3
    }
  ],
  "nutrition": {
    "method": "estimado",
    "calories": 360,
    "proteinGrams": 20,
    "carbsGrams": 36,
    "fatGrams": 16,
    "saturatedFatGrams": 3,
    "fibreGrams": 11,
    "saltGrams": 1.2
  },
  "source": {
    "kind": "gerada",
    "author": "Claude"
  },
  "createdAt": "2026-09-15",
  "updatedAt": "2026-09-15"
}
